GUID,Name,Description,CVSS3.0,Network Zone,Exploit Code Maturity,Actively Exploited,Patch Available,Dark Web References,Risk Score,Risk Severity
1b19f23a-ee9f-440b-a4d4-7a942999787f,CVE-2023-3531,Cross-site Scripting (XSS) - Stored in GitHub repository nilsteampassnet/teampass prior to 3.0.10.,7.1,public facing,proof-of-concept,no,yes,681,,
e23e8c34-a337-427f-88b4-e9ef9fc9373b,CVE-2023-35309,Microsoft Message Queuing Remote Code Execution Vulnerability,3.5,internal,non-existent,yes,yes,961,,
f7903d34-6afe-4cea-b8fe-231830413ec2,CVE-2023-35308,Windows MSHTML Platform Security Feature Bypass Vulnerability,4.4,public facing,proof-of-concept,yes,yes,9,,
e904d37a-c544-4755-a671-e4205aa5f708,CVE-2023-35306,Microsoft PostScript and PCL6 Class Printer Driver Information Disclosure Vulnerability,7.5,internal,functional,yes,yes,952,,
006ae644-3d56-4536-85f6-76bb96d529a7,CVE-2023-35305,Windows Kernel Elevation of Privilege Vulnerability,5.6,internal,proof-of-concept,no,no,166,,
0a04452e-4a18-4ee2-b46c-3cddd052307b,CVE-2023-35304,Windows Kernel Elevation of Privilege Vulnerability,2.5,internal,proof-of-concept,yes,yes,72,,
c7d2b710-e895-43c0-bc75-3da5a962bf84,CVE-2023-35303,USB Audio Class System Driver Remote Code Execution Vulnerability,2.4,internal,functional,no,yes,197,,
07c79008-81a8-47ab-a014-ccfff7461284,CVE-2023-35302,Microsoft PostScript and PCL6 Class Printer Driver Remote Code Execution Vulnerability,10,internal,non-existent,yes,no,239,,
c1e2ff59-dff0-42a9-8b8f-c15139b3a8f7,CVE-2023-35300,Remote Procedure Call Runtime Remote Code Execution Vulnerability,7.7,internal,functional,yes,no,645,,
a950076d-1503-4a79-9380-ed403a975566,CVE-2023-35299,Windows Common Log File System Driver Elevation of Privilege Vulnerability,7.5,internal,proof-of-concept,no,no,505,,
488bbaae-3a00-42d7-90f9-bb9c43b5fa5b,CVE-2023-35298,HTTP.sys Denial of Service Vulnerability,10,internal,proof-of-concept,no,yes,806,,
62db5d18-13bb-4fda-8dbc-efcafdff1e59,CVE-2023-35297,Windows Pragmatic General Multicast (PGM) Remote Code Execution Vulnerability,3,internal,non-existent,no,no,415,,
505cb7ff-985a-426b-a5a9-f844475439c2,CVE-2023-35296,Microsoft PostScript and PCL6 Class Printer Driver Information Disclosure Vulnerability,8.7,internal,non-existent,no,yes,503,,
9e7bcae9-a76c-4cd5-8198-9f7ff72e0938,CVE-2023-3529,A vulnerability classified as problematic has been found in Rotem Dynamics Rotem CRM up to 20230729. This affects an unknown part of the file /LandingPages/api/otp/send?id=[ID][ampersand]method=sms of the component OTP URI Interface. The manipulation leads to information exposure through discrepancy. It is possible to initiate the attack remotely. The identifier VDB-233253 was assigned to this vulnerability. NOTE: The vendor was contacted early about this disclosure but did not respond in any way.,5.4,public facing,functional,yes,yes,478,,
49121c00-7e0d-4a46-ab92-21bd23a2d10c,CVE-2023-3528,A vulnerability was found in ThinuTech ThinuCMS 1.5. It has been rated as critical. Affected by this issue is some unknown functionality of the file /category.php. The manipulation of the argument cat_id leads to sql injection. The attack may be launched remotely. The identifier of this vulnerability is VDB-233252.,2,public facing,non-existent,no,yes,282,,
3068d48b-2a87-46dd-aa11-90fe09815ee7,CVE-2023-3527,"A CSV injection vulnerability was found in the Avaya Call Management System (CMS) Supervisor web application which allows a user with administrative privileges to input crafted data which, when exported to a CSV file, may attempt arbitrary command execution on the system used to open the file by a spreadsheet software such as Microsoft Excel.",1.1,internal,functional,yes,no,874,,
8f61065a-d907-467a-bb25-61916e26c03b,CVE-2023-3525,"The Getnet Argentina para Woocommerce plugin for WordPress is vulnerable to authorization bypass due to missing validation on the 'webhook' function in versions up to, and including, 0.0.4. This makes it possible for unauthenticated attackers to set their payment status to 'APPROVED' without payment.",9.9,public facing,non-existent,no,yes,638,,
037785f8-a113-4cd3-b94d-0d030335ad8b,CVE-2023-3523,Out-of-bounds Read in GitHub repository gpac/gpac prior to 2.2.2.,5,public facing,proof-of-concept,yes,yes,854,,
0656633b-7d33-4a96-b8b5-23eff5cec1b6,CVE-2023-3521,Cross-site Scripting (XSS) - Reflected in GitHub repository fossbilling/fossbilling prior to 0.5.4.,1.7,public facing,proof-of-concept,yes,no,804,,
dd0bb9b2-194c-425f-aff7-aee510256a02,CVE-2023-3520,Sensitive Cookie in HTTPS Session Without 'Secure' Attribute in GitHub repository it-novum/openitcockpit prior to 4.6.6.,5.2,public facing,non-existent,yes,yes,942,,
91b233a9-ed80-45d6-8aef-e1308f0e175a,CVE-2023-3519,Unauthenticated remote code execution,6,internal,proof-of-concept,no,yes,907,,
eab0f2c5-b5b6-4d91-8cc2-c99a16f2145e,CVE-2023-35189,Iagona ScrutisWeb versions 2.1.37 and prior are vulnerable to a remote code execution vulnerability that could allow an unauthenticated user to upload a malicious payload and execute it.,2.4,internal,proof-of-concept,yes,yes,138,,
ebb04005-039b-443f-9cb0-06a6ed60171e,CVE-2023-35178,Certain HP LaserJet Pro print products are potentially vulnerable to Buffer Overflow when performing a GET request to scan jobs.,1.1,internal,proof-of-concept,yes,no,780,,
9641598f-461e-4568-9eff-6ceacbecfbcd,CVE-2023-35177,Certain HP LaserJet Pro print products are potentially vulnerable to a stack-based buffer overflow related to the compact font format parser.,2.8,internal,functional,no,yes,507,,
0991c36b-64b1-4ba6-96e4-6de553d49d1c,CVE-2023-35176,Certain HP LaserJet Pro print products are potentially vulnerable to Buffer Overflow and/or Denial of Service when using the backup & restore feature through the embedded web service on the device.,2.2,internal,non-existent,no,no,844,,
222cd615-579f-43c1-9155-94e8262c7a1f,CVE-2023-35175,Certain HP LaserJet Pro print products are potentially vulnerable to Potential Remote Code Execution and/or Elevation of Privilege via Server-Side Request Forgery (SSRF) using the Web Service Eventing model.,4.8,public facing,non-existent,no,yes,556,,
d7455a4c-53dc-448f-acc6-f17e334fb520,CVE-2023-35174,"Livebook is a web application for writing interactive and collaborative code notebooks. On Windows, it is possible to open a `livebook://` link from a browser which opens Livebook Desktop and triggers arbitrary code execution on victim's machine. Any user using Livebook Desktop on Windows is potentially vulnerable to arbitrary code execution when they expect Livebook to be opened from browser. This vulnerability has been fixed in version 0.8.2 and 0.9.3.",3.1,public facing,proof-of-concept,yes,no,769,,
ec8e4d2c-ccc8-44f2-b4b9-b009b43a7982,CVE-2023-35173,"Nextcloud End-to-end encryption app provides all the necessary APIs to implement End-to-End encryption on the client side. By providing an invalid meta data file, an attacker can make previously dropped files inaccessible. It is recommended that the Nextcloud End-to-end encryption app is upgraded to version 1.12.4 that contains the fix.",9,internal,non-existent,no,no,70,,
f4146c06-344c-4681-bd4b-0e4414a62d15,CVE-2023-35172,"NextCloud Server and NextCloud Enterprise Server provide file storage for Nextcloud, a self-hosted productivity platform. In NextCloud Server versions 25.0.0 until 25.0.7 and 26.0.0 until 26.0.2 and Nextcloud Enterprise Server versions 21.0.0 until 21.0.9.12, 22.0.0 until 22.2.10.12, 23.0.0 until 23.0.12.7, 24.0.0 until 24.0.12.2, 25.0.0 until 25.0.7, and 26.0.0 until 26.0.2, an attacker can bruteforce the password reset links. Nextcloud Server n 25.0.7 and 26.0.2 and Nextcloud Enterprise Server 21.0.9.12, 22.2.10.12, 23.0.12.7, 24.0.12.2, 25.0.7, and 26.0.2 contain a patch for this issue. No known workarounds are available.",9,internal,functional,yes,no,641,,
7f03731d-4c50-41c7-8b66-454abf1c04a8,CVE-2023-35171,"NextCloud Server and NextCloud Enterprise Server provide file storage for Nextcloud, a self-hosted productivity platform. Starting in version 26.0.0 and prior to version 26.0.2, an attacker could supply a URL that redirects an unsuspecting victim from a legitimate domain to an attacker's site. Nextcloud Server and Nextcloud Enterprise Server 26.0.2 contain a patch for this issue. No known workarounds are available.",6.7,public facing,functional,no,yes,322,,
aca74363-45b4-455f-beb8-e40f9202566a,CVE-2023-35170,This CVE is a duplicate of another CVE.,4.6,internal,functional,yes,yes,629,,
531f7a08-c40b-44dd-91ea-2a6099ea59b0,CVE-2023-35169,"PHP-IMAP is a wrapper for common IMAP communication without the need to have the php-imap module installed / enabled. Prior to version 5.3.0, an unsanitized attachment filename allows any unauthenticated user to leverage a directory traversal vulnerability, which results in a remote code execution vulnerability. Every application that stores attachments with `Attachment::save()` without providing a `$filename` or passing unsanitized user input is affected by this attack. An attacker can send an email with a malicious attachment to the inbox, which gets crawled with `webklex/php-imap` or `webklex/laravel-imap`. Prerequisite for the vulnerability is that the script stores the attachments without providing a `$filename`, or providing an unsanitized `$filename`, in `src/Attachment::save(string $path, string $filename = null)`. In this case, where no `$filename` gets passed into the `Attachment::save()` method, the package would use a series of unsanitized and insecure input values from the mail as fallback. Even if a developer passes a `$filename` into the `Attachment::save()` method, e.g. by passing the name or filename of the mail attachment itself (from email headers), the input values never get sanitized by the package. There is also no restriction about the file extension (e.g. "".php"") or the contents of a file. This allows an attacker to upload malicious code of any type and content at any location where the underlying user has write permissions. The attacker can also overwrite existing files and inject malicious code into files that, e.g. get executed by the system via cron or requests. Version 5.3.0 contains a patch for this issue.",4.3,internal,functional,yes,no,617,,
79095392-d7f7-4fd3-b72b-dcb235faa630,CVE-2023-35168,"DataEase is an open source data visualization analysis tool to analyze data and gain insight into business trends. Affected versions of DataEase has a privilege bypass vulnerability where ordinary users can gain access to the user database. Exposed information includes md5 hashes of passwords, username, email, and phone number. The vulnerability has been fixed in v1.18.8. Users are advised to upgrade. There are no known workarounds for the vulnerability.",2.6,internal,functional,yes,yes,614,,
41c5a446-e45a-4462-b7f8-f3fa47b375b2,CVE-2023-35167,"Remult is a CRUD framework for full-stack TypeScript. If you used the apiPrefilter option of the `@Entity` decorator, by setting it to a function that returns a filter that prevents unauthorized access to data, an attacker who knows the `id` of an entity instance is not authorized to access, can gain read, update and delete access to it. The issue is fixed in version 0.20.6. As a workaround, set the `apiPrefilter` option to a filter object instead of a function.",7.2,public facing,non-existent,no,yes,39,,
51f2eda2-2013-4d3c-8926-07fee4489133,CVE-2023-35166,XWiki Platform is a generic wiki platform offering runtime services for applications built on top of it. It's possible to execute any wiki content with the right of the TipsPanel author by creating a tip UI extension. This has been patched in XWiki 15.1-rc-1 and 14.10.5.,8.5,internal,non-existent,yes,yes,871,,
2abe77f3-a3e0-492a-8f25-7b97d07d1f9b,CVE-2023-35165,"AWS Cloud Development Kit (AWS CDK) is an open-source software development framework to define cloud infrastructure in code and provision it through AWS CloudFormation. In the packages `aws-cdk-lib` 2.0.0 until 2.80.0 and `@aws-cdk/aws-eks` 1.57.0 until 1.202.0, `eks.Cluster` and `eks.FargateCluster` constructs create two roles, `CreationRole` and `default MastersRole`, that have an overly permissive trust policy. The first, referred to as the `CreationRole`, is used by lambda handlers to create the cluster and deploy Kubernetes resources (e.g `KubernetesManifest`, `HelmChart`, ...) onto it. Users with CDK version higher or equal to 1.62.0 (including v2 users) may be affected. The second, referred to as the `default MastersRole`, is provisioned only if the `mastersRole` property isn't provided and has permissions to execute `kubectl` commands on the cluster. Users with CDK version higher or equal to 1.57.0 (including v2 users) may be affected. The issue has been fixed in `@aws-cdk/aws-eks` v1.202.0 and `aws-cdk-lib` v2.80.0. These versions no longer use the account root principal. Instead, they restrict the trust policy to the specific roles of lambda handlers that need it. There is no workaround available for CreationRole. To avoid creating the `default MastersRole`, use the `mastersRole` property to explicitly provide a role.",5.9,public facing,functional,yes,no,796,,
3da050c9-3e3c-41f9-b72c-dbf824787b00,CVE-2023-35164,DataEase is an open source data visualization analysis tool to analyze data and gain insight into business trends. In affected versions a missing authorization check allows unauthorized users to manipulate a dashboard created by the administrator. This vulnerability has been fixed in version 1.18.8. Users are advised to upgrade. There are no known workarounds for this vulnerability.,10,public facing,functional,yes,no,182,,
06af1a13-85f5-4723-aa31-cfc967f9d4e9,CVE-2023-35163,"Vega is a decentralized trading platform that allows pseudo-anonymous trading of derivatives on a blockchain. Prior to version 0.71.6, a vulnerability exists that allows a malicious validator to trick the Vega network into re-processing past Ethereum events from Vega&#8217;s Ethereum bridge. For example, a deposit to the collateral bridge for 100USDT that credits a party&#8217;s general account on Vega, can be re-processed 50 times resulting in 5000USDT in that party&#8217;s general account. This is without depositing any more than the original 100USDT on the bridge. Despite this exploit requiring access to a validator's Vega key, a validator key can be obtained at the small cost of 3000VEGA, the amount needed to announce a new node onto the network. A patch is available in version 0.71.6. No known workarounds are available, however there are mitigations in place should this vulnerability be exploited. There are monitoring alerts for `mainnet1` in place to identify any issues of this nature including this vulnerability being exploited. The validators have the ability to stop the bridge thus stopping any withdrawals should this vulnerability be exploited.",9.8,public facing,proof-of-concept,yes,yes,902,,
22104338-3f73-4fc6-b27e-5c4468c80236,CVE-2023-35162,"XWiki Platform is a generic wiki platform offering runtime services for applications built on top of it. Users are able to forge an URL with a payload allowing to inject Javascript in the page (XSS). It's possible to exploit the previewactions template to perform a XSS, e.g. by using URL such as: > <hostname>/xwiki/bin/get/FlamingoThemes/Cerulean xpage=xpart&vm=previewactions.vm&xcontinue=javascript:alert(document.domain). This vulnerability exists since XWiki 6.1-rc-1. The vulnerability has been patched in XWiki 14.10.5 and 15.1-rc-1.",8.3,public facing,non-existent,no,no,539,,
6ce384de-d5b7-4393-8938-f8f3366fa776,CVE-2023-35161,"XWiki Platform is a generic wiki platform offering runtime services for applications built on top of it. Users are able to forge an URL with a payload allowing to inject Javascript in the page (XSS). It's possible to exploit the DeleteApplication page to perform a XSS, e.g. by using URL such as: > xwiki/bin/view/AppWithinMinutes/DeleteApplication?appName=Menu&resolve=true&xredirect=javascript:alert(document.domain). This vulnerability exists since XWiki 6.2-milestone-1. The vulnerability has been patched in XWiki 14.10.5 and 15.1-rc-1.",7.5,public facing,proof-of-concept,no,no,828,,
bf29003d-b45d-4647-9436-6722248b6d51,CVE-2023-35160,"XWiki Platform is a generic wiki platform offering runtime services for applications built on top of it. Users are able to forge an URL with a payload allowing to inject Javascript in the page (XSS). It's possible to exploit the resubmit template to perform a XSS, e.g. by using URL such as: > xwiki/bin/view/XWiki/Main xpage=resubmit&resubmit=javascript:alert(document.domain)&xback=javascript:alert(document.domain). This vulnerability exists since XWiki 2.5-milestone-2. The vulnerability has been patched in XWiki 14.10.5 and 15.1-rc-1.",4.2,public facing,non-existent,yes,no,887,,
0aa8a935-636b-4259-8e42-e7847e0da5bf,CVE-2023-35159,"XWiki Platform is a generic wiki platform offering runtime services for applications built on top of it. Users are able to forge an URL with a payload allowing to inject Javascript in the page (XSS). It's possible to exploit the deletespace template to perform a XSS, e.g. by using URL such as: > xwiki/bin/deletespace/Sandbox/?xredirect=javascript:alert(document.domain). This vulnerability exists since XWiki 3.4-milestone-1. The vulnerability has been patched in XWiki 14.10.5 and 15.1-rc-1.",5.4,internal,non-existent,no,no,43,,
f87f2530-23d6-4798-9bdf-6871ac729ebd,CVE-2023-35158,"XWiki Platform is a generic wiki platform offering runtime services for applications built on top of it. Users are able to forge an URL with a payload allowing to inject Javascript in the page (XSS). It's possible to exploit the restore template to perform a XSS, e.g. by using URL such as: > /xwiki/bin/view/XWiki/Main?xpage=restore&showBatch=true&xredirect=javascript:alert(document.domain). This vulnerability exists since XWiki 9.4-rc-1. The vulnerability has been patched in XWiki 14.10.5 and 15.1-rc-1.",1.5,internal,proof-of-concept,no,no,675,,
9fe5ca51-532c-4854-a2e8-4bc77eced8c3,CVE-2023-35157,"XWiki Platform is a generic wiki platform offering runtime services for applications built on top of it. It's possible to perform an XSS by forging a request to a delete attachment action with a specific attachment name. Now this XSS can be exploited only if the attacker knows the CSRF token of the user, or if the user ignores the warning about the missing CSRF token. The vulnerability has been patched in XWiki 15.1-rc-1 and XWiki 14.10.6.",8.8,internal,proof-of-concept,no,yes,908,,
c1619015-bce7-4063-9671-e8572be20abf,CVE-2023-35156,"XWiki Platform is a generic wiki platform offering runtime services for applications built on top of it. Users are able to forge an URL with a payload allowing to inject Javascript in the page (XSS). It's possible to exploit the delete template to perform a XSS, e.g. by using URL such as: > xwiki/bin/get/FlamingoThemes/Cerulean?xpage=xpart&vm=delete.vm&xredirect=javascript:alert(document.domain). This vulnerability exists since XWiki 6.0-rc-1. The vulnerability has been patched in XWiki 14.10.6 and 15.1. Note that a partial patch has been provided in 14.10.5 but wasn't enough to entirely fix the vulnerability.",6.7,internal,non-existent,yes,yes,308,,
772af566-34c1-4b62-8656-defc80d14f30,CVE-2023-35155,"XWiki Platform is a generic wiki platform offering runtime services for applications built on top of it. Users are able to forge an URL with a payload allowing to inject Javascript in the page (XSS). For instance, the following URL execute an `alter` on the browser: `<xwiki-host>/xwiki/bin/view/Main/?viewer=share&send=1&target=&target=%3Cimg+src+onerror%3Dalert%28document.domain%29%3E+%3Cimg+src+onerror%3Dalert%28document.domain%29%3E+%3Crenniepak%40intigriti.me%3E&includeDocument=inline&message=I+wanted+to+share+this+page+with+you.`, where `<xwiki-host>` is the URL of your XWiki installation. The vulnerability has been patched in XWiki 15.0-rc-1, 14.10.4, and 14.4.8.",6.1,internal,functional,yes,yes,76,,
485561af-78bd-49b6-a96c-932abb80294c,CVE-2023-35154,"Knowage is an open source analytics and business intelligence suite. Starting in version 6.0.0 and prior to version 8.1.8, an attacker can register and activate their account without having to click on the link included in the email, allowing them access to the application as a normal user. This issue has been patched in version 8.1.8.",9,public facing,proof-of-concept,no,yes,762,,
0c3dde68-7fb7-4aee-a994-a7e168ffffcd,CVE-2023-35153,"XWiki Platform is a generic wiki platform. Starting in version 5.4.4 and prior to versions 14.4.8, 14.10.4, and 15.0, a stored cross-site scripting vulnerability can be exploited by users with edit rights by adding a `AppWithinMinutes.FormFieldCategoryClass` class on a page and setting the payload on the page title. Then, any user visiting `/xwiki/bin/view/AppWithinMinutes/ClassEditSheet` executes the payload. The issue has been patched in XWiki 14.4.8, 14.10.4, and 15.0. As a workaround, update `AppWithinMinutes.ClassEditSheet` with a patch.",5.6,public facing,functional,no,no,667,,
1b5200be-b21c-4342-9940-eaf4a1c6d4d4,CVE-2023-35152,"XWiki Platform is a generic wiki platform. Starting in version 12.9-rc-1 and prior to versions 14.4.8, 14.10.6, and 15.1, any logged in user can add dangerous content in their first name field and see it executed with programming rights. Leading to rights escalation. The vulnerability has been fixed on XWiki 14.4.8, 14.10.6, and 15.1. As a workaround, one may apply the patch manually.",5.1,public facing,functional,no,no,90,,
7153ecac-a7ad-4fdf-beb3-dbe5606a1a61,CVE-2023-35151,"XWiki Platform is a generic wiki platform. Starting in version 7.3-milestone-1 and prior to versions 14.4.8, 14.10.6, and 15.1, ny user can call a REST endpoint and obtain the obfuscated passwords, even when the mail obfuscation is activated. The issue has been patched in XWiki 14.4.8, 14.10.6, and 15.1. There is no known workaround.",7.7,public facing,functional,yes,no,18,,
8e588ffa-5fb0-4106-af19-854aa6e565fe,CVE-2023-35150,"XWiki Platform is a generic wiki platform offering runtime services for applications built on top of it. Starting in version 2.40m-2 and prior to versions 14.4.8, 14.10.4, and 15.0, any user with view rights on any document can execute code with programming rights, leading to remote code execution by crafting an url with a dangerous payload. The problem has been patched in XWiki 15.0, 14.10.4 and 14.4.8.",4.2,internal,functional,yes,yes,311,,
f0923aa0-99d3-4ec1-9e2a-b100a31599da,CVE-2023-3515,Open Redirect in GitHub repository go-gitea/gitea prior to 1.19.4.,3.8,internal,proof-of-concept,no,no,829,,
f236d7f5-f686-44fc-b95c-b477b52eaf2f,CVE-2023-35149,"A missing permission check in Jenkins Digital.ai App Management Publisher Plugin 2.6 and earlier allows attackers with Overall/Read permission to connect to an attacker-specified URL, capturing credentials stored in Jenkins.",3.1,public facing,proof-of-concept,yes,no,623,,
ac77d89b-51ad-4090-9439-c7172ccfa9a5,CVE-2023-35148,"A cross-site request forgery (CSRF) vulnerability in Jenkins Digital.ai App Management Publisher Plugin 2.6 and earlier allows attackers to connect to an attacker-specified URL, capturing credentials stored in Jenkins.",6.9,public facing,functional,yes,no,295,,
4b3ff59e-a517-45a7-a7a4-9dae685fbe82,CVE-2023-35147,"Jenkins AWS CodeCommit Trigger Plugin 3.0.12 and earlier does not restrict the AWS SQS queue name path parameter in an HTTP endpoint, allowing attackers with Item/Read permission to obtain the contents of arbitrary files on the Jenkins controller file system.",6.1,public facing,proof-of-concept,no,no,428,,
bb8c671a-99e6-43c9-912a-d25f7542f9f2,CVE-2023-35146,"Jenkins Template Workflows Plugin 41.v32d86a_313b_4a and earlier does not escape names of jobs used as buildings blocks for Template Workflow Job, resulting in a stored cross-site scripting (XSS) vulnerability exploitable by attackers able to create jobs.",6.5,internal,proof-of-concept,yes,no,578,,
4f53c6ea-b1e7-4b13-9586-563997a34db4,CVE-2023-35145,"Jenkins Sonargraph Integration Plugin 5.0.1 and earlier does not escape the file path and the project name for the Log file field form validation, resulting in a stored cross-site scripting vulnerability exploitable by attackers with Item/Configure permission.",8.7,public facing,non-existent,no,no,992,,
27cb9e7e-cd68-4a22-a5cd-ee02ab683f51,CVE-2023-35144,"Jenkins Maven Repository Server Plugin 1.10 and earlier does not escape project and build display names on the Build Artifacts As Maven Repository page, resulting in a stored cross-site scripting (XSS) vulnerability.",4.7,public facing,proof-of-concept,yes,no,179,,
8975d993-ee7f-43e3-9d84-b7e264ef1ce7,CVE-2023-35143,"Jenkins Maven Repository Server Plugin 1.10 and earlier does not escape the versions of build artifacts on the Build Artifacts As Maven Repository page, resulting in a stored cross-site scripting (XSS) vulnerability exploitable by attackers able to control maven project versions in `pom.xml`.",5.1,public facing,non-existent,yes,yes,881,,
ab5c0b41-cbb2-48bc-8710-19ddea41e803,CVE-2023-35142,Jenkins Checkmarx Plugin 2022.4.3 and earlier disables SSL/TLS validation for connections to the Checkmarx server by default.,2.8,internal,proof-of-concept,yes,no,520,,
7b3465f2-da29-461e-94e4-eb8a3367c453,CVE-2023-35141,"In Jenkins 2.399 and earlier, LTS 2.387.3 and earlier, POST requests are sent in order to load the list of context actions. If part of the URL includes insufficiently escaped user-provided values, a victim may be tricked into sending a POST request to an unexpected endpoint by opening a context menu.",4.5,public facing,proof-of-concept,yes,no,49,,
