GUID,Name,Description,CVSS3.0,Network Zone,Exploit Code Maturity,Actively Exploited,Patch Available,Dark Web References,Risk Score,Risk Severity
9112cdf3-0b3d-4f64-bd7d-470b9f18aceb,CVE-2023-36872,VP9 Video Extensions Information Disclosure Vulnerability,9.8,internal,proof-of-concept,no,no,565,,
c3531579-2736-45ca-98d7-f49520b67e83,CVE-2023-36871,Azure Active Directory Security Feature Bypass Vulnerability,7.3,internal,proof-of-concept,yes,no,69,,
2fbf56ce-ebae-467a-b0a1-e42c5621c4a9,CVE-2023-3687,A vulnerability was found in Bylancer QuickVCard 2.1. It has been rated as critical. This issue affects some unknown processing of the file /blog of the component GET Parameter Handler. The manipulation of the argument s leads to sql injection. The attack may be initiated remotely. The identifier VDB-234233 was assigned to this vulnerability. NOTE: The vendor was contacted early about this disclosure but did not respond in any way.,6.4,public facing,proof-of-concept,no,yes,363,,
0a89b6f4-48e9-491e-b20d-119d6b803610,CVE-2023-36868,Azure Service Fabric on Windows Information Disclosure Vulnerability,9.8,public facing,non-existent,no,no,183,,
80a93085-b2de-48b6-851c-5eae8cf17580,CVE-2023-36867,Visual Studio Code GitHub Pull Requests and Issues Extension Remote Code Execution Vulnerability,7.1,internal,functional,no,no,162,,
76017ebb-9756-444d-ab0e-d9216e6f0d42,CVE-2023-36862,A downgrade issue affecting Intel-based Mac computers was addressed with additional code-signing restrictions. This issue is fixed in macOS Ventura 13.5. An app may be able to determine a user&#8217;s current location.,5.3,internal,functional,yes,yes,621,,
6e16ac8f-5e46-4d55-9c35-6a0cb1c28aaa,CVE-2023-3686,A vulnerability was found in Bylancer QuickAI OpenAI 3.8.1. It has been declared as critical. This vulnerability affects unknown code of the file /blog of the component GET Parameter Handler. The manipulation of the argument s leads to sql injection. The attack can be initiated remotely. The identifier of this vulnerability is VDB-234232. NOTE: The vendor was contacted early about this disclosure but did not respond in any way.,1.8,public facing,non-existent,no,no,619,,
ba43cb94-ebc2-4376-869b-e0cb6f8d440e,CVE-2023-36859,"PiiGAB M-Bus SoftwarePack 900S does not correctly sanitize user input, which could allow an attacker to inject arbitrary commands.",6.6,internal,proof-of-concept,yes,no,845,,
aa09316b-2138-4320-b712-3e7acef0648a,CVE-2023-36854,"The issue was addressed with improved checks. This issue is fixed in macOS Monterey 12.6.8, macOS Ventura 13.5, macOS Big Sur 11.7.9. Processing a file may lead to unexpected app termination or arbitrary code execution.",4.4,internal,non-existent,yes,yes,821,,
116b7d89-6305-43cd-82c0-28557d9314d0,CVE-2023-36853,"&#8203;In Keysight Geolocation Server v2.4.2 and prior, a low privileged attacker could create a local ZIP file containing a malicious script in any location. The attacker could abuse this to load a DLL with SYSTEM privileges.",4.5,public facing,functional,yes,yes,320,,
c7ab882f-55e2-46d4-b7eb-86573acb3b2b,CVE-2023-36850,"An Improper Validation of Specified Index, Position, or Offset in Input vulnerability in the Connectivity Fault Management(CFM) module of Juniper Networks Junos OS on MX Series(except MPC10, MPC11 and LC9600) allows an adjacent attacker on the local broadcast domain to cause a Denial of Service(DoS). Upon receiving a malformed CFM packet, the MPC crashes. Continued receipt of these packets causes a sustained denial of service. This issue can only be triggered when CFM hasn't been configured. This issue affects: Juniper Networks Junos OS All versions prior to 19.1R3-S10 on MX Series; 19.2 versions prior to 19.2R3-S7 on MX Series; 19.3 versions prior to 19.3R3-S8 on MX Series; 19.4 versions prior to 19.4R3-S12 on MX Series; 20.1 version 20.1R1 and later versions on MX Series; 20.2 versions prior to 20.2R3-S7 on MX Series; 20.3 version 20.3R1 and later versions on MX Series; 20.4 versions prior to 20.4R3-S7 on MX Series; 21.1 versions prior to 21.1R3-S5 on MX Series; 21.2 versions prior to 21.2R3-S4 on MX Series; 21.3 versions prior to 21.3R3-S4 on MX Series; 21.4 versions prior to 21.4R3-S3 on MX Series; 22.1 versions prior to 22.1R3-S2 on MX Series; 22.2 versions prior to 22.2R3 on MX Series; 22.3 versions prior to 22.3R2, 22.3R3 on MX Series; 22.4 versions prior to 22.4R2 on MX Series.",2.5,public facing,proof-of-concept,yes,no,330,,
de77d680-2e6b-4cc8-b937-f2f408612fcf,CVE-2023-3685,A vulnerability was found in Nesote Inout Search Engine AI Edition 1.1. It has been classified as problematic. This affects an unknown part of the file /index.php. The manipulation of the argument page leads to cross site scripting. It is possible to initiate the attack remotely. The associated identifier of this vulnerability is VDB-234231. NOTE: The vendor was contacted early about this disclosure but did not respond in any way.,8.8,public facing,functional,yes,no,867,,
15dfd0e1-b9c0-4a92-89d5-e12ec7b45e4c,CVE-2023-36849,"An Improper Check or Handling of Exceptional Conditions vulnerability in the Layer-2 control protocols daemon (l2cpd) of Juniper Networks Junos OS and Junos OS Evolved allows an unauthenticated adjacent attacker to cause a Denial of Service (DoS). When a malformed LLDP packet is received, l2cpd will crash and restart. The impact of the l2cpd crash is reinitialization of STP protocols (RSTP, MSTP or VSTP), and MVRP and ERP. Also, if any services depend on LLDP state (like PoE or VoIP device recognition), then these will also be affected. Continued receipt of such packets will lead to a sustained Denial of Service. This issue affects: Juniper Networks Junos OS 21.4 versions prior to 21.4R3-S3; 22.1 versions prior to 22.1R3-S3; 22.2 versions prior to 22.2R2-S1, 22.2R3; 22.3 versions prior to 22.3R2. Juniper Networks Junos OS Evolved 21.4-EVO versions prior to 21.4R3-S2-EVO; 22.1-EVO versions prior to 22.1R3-S3-EVO; 22.2-EVO versions prior to 22.2R2-S1-EVO, 22.2R3-EVO; 22.3-EVO versions prior to 22.3R2-EVO.",8.1,public facing,proof-of-concept,yes,no,492,,
5f6e4b0c-6604-43d6-b3f4-a593d282ae7f,CVE-2023-36848,"An Improper Handling of Undefined Values vulnerability in the periodic packet management daemon (PPMD) of Juniper Networks Junos OS on MX Series(except MPC10, MPC11 and LC9600) allows an unauthenticated adjacent attacker to cause a Denial of Service (DoS). When a malformed CFM packet is received, it leads to an FPC crash. Continued receipt of these packets causes a sustained denial of service. This vulnerability occurs only when CFM has been configured on the interface. This issue affects Juniper Networks Junos OS: versions prior to 19.1R3-S10 on MX Series; 19.2 versions prior to 19.2R3-S7 on MX Series; 19.3 versions prior to 19.3R3-S8 on MX Series; 19.4 versions prior to 19.4R3-S12 on MX Series; 20.1 version 20.1R1 and later versions on MX Series; 20.2 versions prior to 20.2R3-S8 on MX Series; 20.3 version 20.3R1 and later versions on MX Series; 20.4 versions prior to 20.4R3-S7 on MX Series; 21.1 versions prior to 21.1R3-S5 on MX Series; 21.2 versions prior to 21.2R3-S5 on MX Series; 21.3 versions prior to 21.3R3-S4 on MX Series; 21.4 versions prior to 21.4R3-S4 on MX Series; 22.1 versions prior to 22.1R3-S3 on MX Series; 22.2 versions prior to 22.2R3-S1 on MX Series; 22.3 versions prior to 22.3R3 on MX Series; 22.4 versions prior to 22.4R1-S2, 22.4R2 on MX Series.",6.1,internal,functional,no,yes,927,,
4b72c9e6-276a-4d93-9dbc-001449d0f9e3,CVE-2023-36840,"A Reachable Assertion vulnerability in Routing Protocol Daemon (RPD) of Juniper Networks Junos OS and Junos OS Evolved allows a locally-based, low-privileged attacker to cause a Denial of Service (DoS). On all Junos OS and Junos OS Evolved, when a specific L2VPN command is run, RPD will crash and restart. Continued execution of this specific command will create a sustained Denial of Service (DoS) condition. This issue affects: Juniper Networks Junos OS All versions prior to 19.3R3-S10; 20.1 versions prior to 20.1R3-S4; 20.2 versions prior to 20.2R3-S6; 20.3 versions prior to 20.3R3-S6; 20.4 versions prior to 20.4R3-S5; 21.1 versions prior to 21.1R3-S4; 21.2 versions prior to 21.2R3-S3; 21.3 versions prior to 21.3R3-S2; 21.4 versions prior to 21.4R3; 22.1 versions prior to 22.1R3; 22.2 versions prior to 22.2R2; 22.3 versions prior to 22.3R2; Juniper Networks Junos OS Evolved All versions prior to 20.4R3-S7-EVO; 21.1 versions prior to 21.1R3-S3-EVO; 21.2 versions prior to 21.2R3-S5-EVO; 21.3 versions prior to 21.3R3-S4-EVO; 21.4 versions prior to 21.4R3-EVO; 22.1 versions prior to 22.1R3-EVO; 22.2 versions prior to 22.2R2-EVO; 22.3 versions prior to 22.3R2-EVO;",9.9,internal,proof-of-concept,yes,yes,979,,
a9e5d2fd-71ef-47f6-a4ee-f0f271fff1fc,CVE-2023-3684,A vulnerability was found in LivelyWorks Articart 2.0.1 and classified as problematic. Affected by this issue is some unknown functionality of the file /change-language/de_DE of the component Base64 Encoding Handler. The manipulation of the argument redirectTo leads to open redirect. The attack may be launched remotely. VDB-234230 is the identifier assigned to this vulnerability. NOTE: The vendor was contacted early about this disclosure but did not respond in any way.,7.7,public facing,non-existent,yes,no,662,,
b213b13b-8329-4b13-9e4a-c542586b18af,CVE-2023-36838,"An Out-of-bounds Read vulnerability in the flow processing daemon (flowd) of Juniper Networks Junos OS on SRX Series allows a local, authenticated attacker with low privileges, to cause a Denial of Service (DoS). If a low privileged user executes a specific CLI command, flowd which is responsible for traffic forwarding in SRX crashes and generates a core dump. This will cause temporary traffic interruption until the flowd process is restarted automatically. Continued execution of this command will lead to a sustained DoS. This issue affects Juniper Networks Junos OS on SRX Series: All versions prior to 20.2R3-S7; 20.3 version 20.3R1 and later versions; 20.4 versions prior to 20.4R3-S6; 21.1 versions prior to 21.1R3-S5; 21.2 versions prior to 21.2R3-S4; 21.3 versions prior to 21.3R3-S4; 21.4 versions prior to 21.4R3-S3; 22.1 versions prior to 22.1R3-S1; 22.2 versions prior to 22.2R3; 22.3 versions prior to 22.3R2; 22.4 versions prior to 22.4R1-S1, 22.4R2.",5.5,internal,functional,no,yes,563,,
3c7c6e87-b592-44dd-b9e5-339ab5cf2981,CVE-2023-36836,"A Use of an Uninitialized Resource vulnerability in the routing protocol daemon (rpd) of Juniper Networks Junos OS and Junos OS Evolved allows a local, authenticated attacker with low privileges to cause a Denial of Service (DoS). On all Junos OS and Junos OS Evolved platforms, in a Multicast only Fast Reroute (MoFRR) scenario, the rpd process can crash when a a specific low privileged CLI command is executed. The rpd crash will impact all routing protocols until the process has automatically been restarted. As the operational state which makes this issue exploitable is outside the attackers control, this issue is considered difficult to exploit. Continued execution of this command will lead to a sustained DoS. This issue affects: Juniper Networks Junos OS 19.4 version 19.4R3-S5 and later versions prior to 19.4R3-S9; 20.1 version 20.1R2 and later versions; 20.2 versions prior to 20.2R3-S7; 20.3 versions prior to 20.3R3-S5; 20.4 versions prior to 20.4R3-S6; 21.1 versions prior to 21.1R3-S4; 21.2 versions prior to 21.2R3-S2; 21.3 versions prior to 21.3R3-S1; 21.4 versions prior to 21.4R3; 22.1 versions prior to 22.1R1-S2, 22.1R2; 22.2 versions prior to 22.2R2. Juniper Networks Junos OS Evolved All versions prior to 20.4R3-S6-EVO; 21.1-EVO version 21.1R1-EVO and later versions; 21.2-EVO version 21.2R1-EVO and later versions; 21.3-EVO versions prior to 21.3R3-S1-EVO; 21.4-EVO versions prior to 21.4R3-EVO; 22.1-EVO versions prior to 22.1R1-S2-EVO, 22.1R2-EVO; 22.2-EVO versions prior to 22.2R2-EVO.",1.8,internal,non-existent,no,no,818,,
648cc15e-6100-4cb4-895d-5e56712503fa,CVE-2023-36835,"An Improper Check for Unusual or Exceptional Conditions vulnerability in the Packet Forwarding Engine (PFE) of Juniper Networks Junos OS on QFX10000 Series allows a network based attacker to cause a Denial of Service (DoS). If a specific valid IP packet is received and that packet needs to be routed over a VXLAN tunnel, this will result in a PFE wedge condition due to which traffic gets impacted. As this is not a crash and restart scenario, this condition will persist until the system is rebooted to recover. This issue affects Juniper Networks Junos OS on QFX10000: 20.3 version 20.3R1 and later versions; 20.4 versions prior to 20.4R3-S5; 21.1 versions prior to 21.1R3-S5; 21.2 versions prior to 21.2R3-S5; 21.3 versions prior to 21.3R3-S4; 21.4 versions prior to 21.4R3-S1; 22.1 versions prior to 22.1R3; 22.2 versions prior to 22.2R2; 22.3 versions prior to 22.3R1-S2, 22.3R2.",2.5,internal,proof-of-concept,yes,no,471,,
208d9c5d-1279-4464-badc-640e8934b480,CVE-2023-36834,"An Incomplete Internal State Distinction vulnerability in the packet forwarding engine (PFE) of Juniper Networks Junos OS on SRX 4600 and SRX 5000 Series allows an adjacent attacker to cause a Denial of Service (DoS). If an SRX is configured in L2 transparent mode the receipt of a specific genuine packet can cause a single Packet Processing Engines (PPE) component of the PFE to run into a loop, which in turn will render the PPE unavailable. Each packet will cause one PPE to get into a loop, leading to a gradual performance degradation until all PPEs are unavailable and all traffic processing stops. To recover the affected FPC need to be restarted. This issue affects Juniper Networks Junos OS on SRX 4600 and SRX 5000 Series: 20.1 version 20.1R1 and later versions; 20.2 versions prior to 20.2R3-S7; 20.3 version 20.3R1 and later versions; 20.4 versions prior to 20.4R3-S7; 21.1 versions prior to 21.1R3-S5; 21.2 versions prior to 21.2R3-S3; 21.3 versions prior to 21.3R3-S3; 21.4 versions prior to 21.4R3-S1; 22.1 versions prior to 22.1R3; 22.2 versions prior to 22.2R2; 22.3 versions prior to 22.3R1-S1, 22.3R2.",7.9,internal,proof-of-concept,no,no,472,,
636c19aa-a920-41ce-ad84-7b5cee1af9ce,CVE-2023-36833,"A Use After Free vulnerability in the packet forwarding engine (PFE) of Juniper Networks Junos OS Evolved on PTX10001-36MR, and PTX10004, PTX10008, PTX10016 with LC1201/1202 allows an adjacent, unauthenticated attacker to cause a Denial of Service (DoS). The process 'aftman-bt' will crash after multiple flaps on a multicast-only fast reroute (MoFRR) enabled interface. This will cause the respective FPC to stop forwarding traffic and it needs to be rebooted to restore the service. An indication that the system experienced this issue is the following log message: <date> <hostname> evo-aftmand-bt[<pid>]: [Error] jexpr_fdb: sanity check failed, ... , app_name L3 Mcast Routes This issue affects Juniper Networks Junos OS Evolved on PTX10001-36MR, PTX10004, PTX10008, PTX10016 with LC1201/1202: 21.2 version 21.2R1-EVO and later versions; 21.3 version 21.3R1-EVO and later versions; 21.4 versions prior to 21.4R3-S3-EVO; 22.1 version 22.1R1-EVO and later versions; 22.2 versions prior to 22.2R3-S2-EVO; 22.3 versions prior to 22.3R3-EVO; 22.4 versions prior to 22.4R1-S2-EVO, 22.4R2-EVO.",9.7,internal,non-existent,yes,no,122,,
8e7aaecd-c377-4828-9d0d-ac64ef4a60d0,CVE-2023-36832,"An Improper Handling of Exceptional Conditions vulnerability in packet processing of Juniper Networks Junos OS on MX Series allows an unauthenticated network-based attacker to send specific packets to an Aggregated Multiservices (AMS) interface on the device, causing the packet forwarding engine (PFE) to crash, resulting in a Denial of Service (DoS). Continued receipt and processing of this packet will create a sustained Denial of Service (DoS) condition. This issue is only triggered by packets destined to a local-interface via a service-interface (AMS). AMS is only supported on the MS-MPC, MS-MIC, and MX-SPC3 cards. This issue is not experienced on other types of interfaces or configurations. Additionally, transit traffic does not trigger this issue. This issue affects Juniper Networks Junos OS on MX Series: All versions prior to 19.1R3-S10; 19.2 versions prior to 19.2R3-S7; 19.3 versions prior to 19.3R3-S8; 19.4 versions prior to 19.4R3-S12; 20.2 versions prior to 20.2R3-S8; 20.4 versions prior to 20.4R3-S7; 21.1 versions prior to 21.1R3-S5; 21.2 versions prior to 21.2R3-S5; 21.3 versions prior to 21.3R3-S4; 21.4 versions prior to 21.4R3-S3; 22.1 versions prior to 22.1R3-S2; 22.2 versions prior to 22.2R3; 22.3 versions prior to 22.3R2-S1, 22.3R3; 22.4 versions prior to 22.4R1-S2, 22.4R2.",8.4,public facing,functional,yes,no,778,,
fe1c7c21-1ee8-49bb-81c2-ccaea3ba5ef3,CVE-2023-36831,"An Improper Check or Handling of Exceptional Conditions vulnerability in the UTM (Unified Threat Management) Web-Filtering feature of Juniper Networks Junos OS on SRX Series causes a jbuf memory leak to occur when accessing certain websites, eventually leading to a Denial of Service (DoS) condition. Service restoration is only possible by rebooting the system. The jbuf memory leak only occurs in SSL Proxy and UTM Web-Filtering configurations. Other products, platforms, and configurations are not affected by this vulnerability. This issue affects Juniper Networks Junos OS on SRX Series: 22.2 versions prior to 22.2R3; 22.3 versions prior to 22.3R2-S1, 22.3R3; 22.4 versions prior to 22.4R1-S2, 22.4R2. This issue does not affect Juniper Networks Junos OS versions prior to 22.2R2.",10,internal,non-existent,no,yes,156,,
b14bcf48-9cbc-454e-bf4d-3cf9fd6fc6c3,CVE-2023-36830,"SQLFluff is a SQL linter. Prior to version 2.1.2, in environments where untrusted users have access to the config files, there is a potential security vulnerability where those users could use the `library_path` config value to allow arbitrary python code to be executed via macros. For many users who use SQLFluff in the context of an environment where all users already have fairly escalated privileges, this may not be an issue - however in larger user bases, or where SQLFluff is bundled into another tool where developers still wish to give users access to supply their on rule configuration, this may be an issue. The 2.1.2 release offers the ability for the `library_path` argument to be overwritten on the command line by using the `--library-path` option. This overrides any values provided in the config files and effectively prevents this route of attack for users which have access to the config file, but not to the scripts which call the SQLFluff CLI directly. A similar option is provided for the Python API, where users also have a greater ability to further customise or override configuration as necessary. Unless `library_path` is explicitly required, SQLFluff maintainers recommend using the option `--library-path none` when invoking SQLFluff which will disable the `library-path` option entirely regardless of the options set in the configuration file or via inline config directives. As a workaround, limiting access to - or otherwise validating configuration files before they are ingested by SQLFluff will provides a similar effect and does not require upgrade.",6.3,internal,non-existent,no,yes,253,,
95258534-9fcb-4ec2-ab65-84cd9043e0c6,CVE-2023-3683,A vulnerability has been found in LivelyWorks Articart 2.0.1 and classified as problematic. Affected by this vulnerability is an unknown functionality of the file /items/search. The manipulation of the argument search_term leads to cross site scripting. The attack can be launched remotely. The identifier VDB-234229 was assigned to this vulnerability. NOTE: The vendor was contacted early about this disclosure but did not respond in any way.,4.1,internal,non-existent,yes,no,769,,
715fd1ee-9afc-49ae-b33c-ec8aaf678c97,CVE-2023-36829,"Sentry is an error tracking and performance monitoring platform. Starting in version 23.6.0 and prior to version 23.6.2, the Sentry API incorrectly returns the `access-control-allow-credentials: true` HTTP header if the `Origin` request header ends with the `system.base-hostname` option of Sentry installation. This only affects installations that have `system.base-hostname` option explicitly set, as it is empty by default. Impact is limited since recent versions of major browsers have cross-site cookie blocking enabled by default. However, this flaw could allow other multi-step attacks. The patch has been released in Sentry 23.6.2.",3.6,public facing,functional,no,no,229,,
5dde1fc9-69d6-4040-90b8-d7c175b5860d,CVE-2023-36828,"Statamic is a flat-first, Laravel and Git powered content management system. Prior to version 4.10.0, the SVG tag does not sanitize malicious SVG. Therefore, an attacker can exploit this vulnerability to perform cross-site scripting attacks using SVG, even when using the `sanitize` function. Version 4.10.0 contains a patch for this issue.",9.1,public facing,proof-of-concept,no,no,839,,
c3e29e83-a324-4545-84e6-99a808700938,CVE-2023-36827,"Fides is an open-source privacy engineering platform for managing the fulfillment of data privacy requests in a runtime environment, and the enforcement of privacy regulations in code. A path traversal (directory traversal) vulnerability affects fides versions lower than version `2.15.1`, allowing remote attackers to access arbitrary files on the fides webserver container's filesystem. The vulnerability is patched in fides `2.15.1`. If the Fides webserver API is not directly accessible to attackers and is instead deployed behind a reverse proxy as recommended in Ethyca's security best practice documentation, and the reverse proxy is an AWS application load balancer, the vulnerability can't be exploited by these attackers. An AWS application load balancer will reject this attack with a 400 error. Additionally, any secrets supplied to the container using environment variables rather than a `fides.toml` configuration file are not affected by this vulnerability.",9.2,internal,non-existent,no,no,831,,
3c50a324-1c7b-4722-b344-7834ff1c0c5d,CVE-2023-36826,"Sentry is an error tracking and performance monitoring platform. Starting in version 8.21.0 and prior to version 23.5.2, an authenticated user can download a debug or artifact bundle from arbitrary organizations and projects with a known bundle ID. The user does not need to be a member of the organization or have permissions on the project. A patch was issued in version 23.5.2 to ensure authorization checks are properly scoped on requests to retrieve debug or artifact bundles. Authenticated users who do not have the necessary permissions on the particular project are no longer able to download them. Sentry SaaS users do not need to take any action. Self-Hosted Sentry users should upgrade to version 23.5.2 or higher.",7.5,internal,functional,yes,yes,310,,
c96b3c98-d5f2-4ffd-8759-039cc1642c3a,CVE-2023-36825,"Orchid is a Laravel package that allows application development of back-office applications, admin/user panels, and dashboards. A vulnerability present starting in version 14.0.0-alpha4 and prior to version 14.5.0 is related to the deserialization of untrusted data from the `_state` query parameter, which can result in remote code execution. The issue has been addressed in version 14.5.0. Users are advised to upgrade their software to this version or any subsequent versions that include the patch. There are no known workarounds.",3.2,internal,proof-of-concept,no,yes,49,,
d26f6db0-7d77-4a50-bdf5-3db1da81b0f2,CVE-2023-36824,"Redis is an in-memory database that persists on disk. In Redit 7.0 prior to 7.0.12, extracting key names from a command and a list of arguments may, in some cases, trigger a heap overflow and result in reading random heap memory, heap corruption and potentially remote code execution. Several scenarios that may lead to authenticated users executing a specially crafted `COMMAND GETKEYS` or `COMMAND GETKEYSANDFLAGS`and authenticated users who were set with ACL rules that match key names, executing a specially crafted command that refers to a variadic list of key names. The vulnerability is patched in Redis 7.0.12.",2.1,public facing,non-existent,yes,yes,39,,
dfbbffb6-03e9-4241-9d5e-436e339983e2,CVE-2023-36823,"Sanitize is an allowlist-based HTML and CSS sanitizer. Using carefully crafted input, an attacker may be able to sneak arbitrary HTML and CSS through Sanitize starting with version 3.0.0 and prior to version 6.0.2 when Sanitize is configured to use the built-in ""relaxed"" config or when using a custom config that allows `style` elements and one or more CSS at-rules. This could result in cross-site scripting or other undesired behavior when the malicious HTML and CSS are rendered in a browser. Sanitize 6.0.2 performs additional escaping of CSS in `style` element content, which fixes this issue. Users who are unable to upgrade can prevent this issue by using a Sanitize config that doesn't allow `style` elements, using a Sanitize config that doesn't allow CSS at-rules, or by manually escaping the character sequence `</` as `<\/` in `style` element content.",4.3,internal,functional,no,no,89,,
