GUID,Name,Description,CVSS3.0,Network Zone,Exploit Code Maturity,Actively Exploited,Patch Available,Dark Web References,Risk Score,Risk Severity
3e5222e8-b993-4357-8710-b42674cb69a3,CVE-2023-3446,"Issue summary: Checking excessively long DH keys or parameters may be very slow. Impact summary: Applications that use the functions DH_check(), DH_check_ex() or EVP_PKEY_param_check() to check a DH key or DH parameters may experience long delays. Where the key or parameters that are being checked have been obtained from an untrusted source this may lead to a Denial of Service. The function DH_check() performs various checks on DH parameters. One of those checks confirms that the modulus ('p' parameter) is not too large. Trying to use a very large modulus is slow and OpenSSL will not normally use a modulus which is over 10,000 bits in length. However the DH_check() function checks numerous aspects of the key or parameters that have been supplied. Some of those checks use the supplied modulus value even if it has already been found to be too large. An application that calls DH_check() and supplies a key or parameters obtained from an untrusted source could be vulernable to a Denial of Service attack. The function DH_check() is itself called by a number of other OpenSSL functions. An application calling any of those other functions may similarly be affected. The other functions affected by this are DH_check_ex() and EVP_PKEY_param_check(). Also vulnerable are the OpenSSL dhparam and pkeyparam command line applications when using the '-check' option. The OpenSSL SSL/TLS implementation is not affected by this issue. The OpenSSL 3.0 and 3.1 FIPS providers are not affected by this issue.",7.4,public facing,non-existent,yes,no,519,,
6d74cadc-195f-4f09-aace-55d74145efba,CVE-2023-34459,"OpenZeppelin Contracts is a library for smart contract development. Starting in version 4.7.0 and prior to version 4.9.2, when the `verifyMultiProof`, `verifyMultiProofCalldata`, `procesprocessMultiProof`, or `processMultiProofCalldat` functions are in use, it is possible to construct merkle trees that allow forging a valid multiproof for an arbitrary set of leaves. A contract may be vulnerable if it uses multiproofs for verification and the merkle tree that is processed includes a node with value 0 at depth 1 (just under the root). This could happen inadvertedly for balanced trees with 3 leaves or less, if the leaves are not hashed. This could happen deliberately if a malicious tree builder includes such a node in the tree. A contract is not vulnerable if it uses single-leaf proving (`verify`, `verifyCalldata`, `processProof`, or `processProofCalldata`), or if it uses multiproofs with a known tree that has hashed leaves. Standard merkle trees produced or validated with the @openzeppelin/merkle-tree library are safe. The problem has been patched in version 4.9.2. Some workarounds are available. For those using multiproofs: When constructing merkle trees hash the leaves and do not insert empty nodes in your trees. Using the @openzeppelin/merkle-tree package eliminates this issue. Do not accept user-provided merkle roots without reconstructing at least the first level of the tree. Verify the merkle tree structure by reconstructing it from the leaves.",8.2,public facing,functional,yes,no,348,,
2eeedfce-2a20-4e0e-bf58-ec8068c6aad3,CVE-2023-34458,"mx-chain-go is the official implementation of the MultiversX blockchain protocol, written in golang. When executing a relayed transaction, if the inner transaction failed, it would have increased the inner transaction's sender account nonce. This could have contributed to a limited DoS attack on a targeted account. The fix is a breaking change so a new flag `RelayedNonceFixEnableEpoch` was needed. This was a strict processing issue while validating blocks on a chain. This vulnerability has been patched in version 1.4.17.",4.3,public facing,non-existent,yes,yes,844,,
65f0223d-4a81-4e1b-9cd0-674f02fd6450,CVE-2023-34457,"MechanicalSoup is a Python library for automating interaction with websites. Starting in version 0.2.0 and prior to version 1.3.0, a malicious web server can read arbitrary files on the client using a `<input type=""file"" ...>` inside HTML form. All users of MechanicalSoup's form submission are affected, unless they took very specific (and manual) steps to reset HTML form field values. Version 1.3.0 contains a patch for this issue.",6,public facing,non-existent,no,no,285,,
a57e6b36-c3fc-4468-8219-eda8ae03cf4b,CVE-2023-34455,"snappy-java is a fast compressor/decompressor for Java. Due to use of an unchecked chunk length, an unrecoverable fatal error can occur in versions prior to 1.1.10.1. The code in the function hasNextChunk in the fileSnappyInputStream.java checks if a given stream has more chunks to read. It does that by attempting to read 4 bytes. If it wasn&#8217;t possible to read the 4 bytes, the function returns false. Otherwise, if 4 bytes were available, the code treats them as the length of the next chunk. In the case that the `compressed` variable is null, a byte array is allocated with the size given by the input data. Since the code doesn&#8217;t test the legality of the `chunkSize` variable, it is possible to pass a negative number (such as 0xFFFFFFFF which is -1), which will cause the code to raise a `java.lang.NegativeArraySizeException` exception. A worse case would happen when passing a huge positive value (such as 0x7FFFFFFF), which would raise the fatal `java.lang.OutOfMemoryError` error. Version 1.1.10.1 contains a patch for this issue.",2.6,public facing,proof-of-concept,yes,no,125,,
b6b0f292-5115-4545-8155-30a8be377ff6,CVE-2023-34454,"snappy-java is a fast compressor/decompressor for Java. Due to unchecked multiplications, an integer overflow may occur in versions prior to 1.1.10.1, causing an unrecoverable fatal error. The function `compress(char[] input)` in the file `Snappy.java` receives an array of characters and compresses it. It does so by multiplying the length by 2 and passing it to the rawCompress` function. Since the length is not tested, the multiplication by two can cause an integer overflow and become negative. The rawCompress function then uses the received length and passes it to the natively compiled maxCompressedLength function, using the returned value to allocate a byte array. Since the maxCompressedLength function treats the length as an unsigned integer, it doesn&#8217;t care that it is negative, and it returns a valid value, which is casted to a signed integer by the Java engine. If the result is negative, a `java.lang.NegativeArraySizeException` exception will be raised while trying to allocate the array `buf`. On the other side, if the result is positive, the `buf` array will successfully be allocated, but its size might be too small to use for the compression, causing a fatal Access Violation error. The same issue exists also when using the `compress` functions that receive double, float, int, long and short, each using a different multiplier that may cause the same issue. The issue most likely won&#8217;t occur when using a byte array, since creating a byte array of size 0x80000000 (or any other negative value) is impossible in the first place. Version 1.1.10.1 contains a patch for this issue.",7,internal,proof-of-concept,no,no,113,,
f252f98f-6af5-43af-afcf-ac95b78e1562,CVE-2023-34453,"snappy-java is a fast compressor/decompressor for Java. Due to unchecked multiplications, an integer overflow may occur in versions prior to 1.1.10.1, causing a fatal error. The function `shuffle(int[] input)` in the file `BitShuffle.java` receives an array of integers and applies a bit shuffle on it. It does so by multiplying the length by 4 and passing it to the natively compiled shuffle function. Since the length is not tested, the multiplication by four can cause an integer overflow and become a smaller value than the true size, or even zero or negative. In the case of a negative value, a `java.lang.NegativeArraySizeException` exception will raise, which can crash the program. In a case of a value that is zero or too small, the code that afterwards references the shuffled array will assume a bigger size of the array, which might cause exceptions such as `java.lang.ArrayIndexOutOfBoundsException`. The same issue exists also when using the `shuffle` functions that receive a double, float, long and short, each using a different multiplier that may cause the same issue. Version 1.1.10.1 contains a patch for this vulnerability.",9.5,internal,functional,yes,yes,726,,
5346cf9d-d1cd-47ed-b853-dde05bd66550,CVE-2023-34452,"Grav is a flat-file content management system. In versions 1.7.42 and prior, the ""/forgot_password"" page has a self-reflected cross-site scripting vulnerability that can be exploited by injecting a script into the ""email"" parameter of the request. While this vulnerability can potentially allow an attacker to execute arbitrary code on the user's browser, the impact is limited as it requires user interaction to trigger the vulnerability. As of time of publication, a patch is not available. Server-side validation should be implemented to prevent this vulnerability.",7.2,internal,functional,yes,no,305,,
2537001d-b3eb-41c9-805b-16fce3bd9f03,CVE-2023-34451,"CometBFT is a Byzantine Fault Tolerant (BFT) middleware that takes a state transition machine and replicates it on many machines. The mempool maintains two data structures to keep track of outstanding transactions: a list and a map. These two data structures are supposed to be in sync all the time in the sense that the map tracks the index (if any) of the transaction in the list. In `v0.37.0`, and `v0.37.1`, as well as in `v0.34.28`, and all previous releases of the CometBFT repo2, it is possible to have them out of sync. When this happens, the list may contain several copies of the same transaction. Because the map tracks a single index, it is then no longer possible to remove all the copies of the transaction from the list. This happens even if the duplicated transaction is later committed in a block. The only way to remove the transaction is by restarting the node. The above problem can be repeated on and on until a sizable number of transactions are stuck in the mempool, in order to try to bring down the target node. The problem is fixed in releases `v0.34.29` and `v0.37.2`. Some workarounds are available. Increasing the value of `cache_size` in `config.toml` makes it very difficult to effectively attack a full node. Not exposing the transaction submission RPC's would mitigate the probability of a successful attack, as the attacker would then have to create a modified (byzantine) full node to be able to perform the attack via p2p.",2.5,public facing,non-existent,no,no,651,,
9d9d9357-6080-4766-8713-6f621cefbdc1,CVE-2023-34450,"CometBFT is a Byzantine Fault Tolerant (BFT) middleware that takes a state transition machine and replicates it on many machines. An internal modification made in versions 0.34.28 and 0.37.1 to the way struct `PeerState` is serialized to JSON introduced a deadlock when new function MarshallJSON is called. This function can be called from two places. The first is via logs, setting the `consensus` logging module to ""debug"" level (should not happen in production), and setting the log output format to JSON. The second is via RPC `dump_consensus_state`. Case 1, which should not be hit in production, will eventually hit the deadlock in most goroutines, effectively halting the node. In case 2, only the data structures related to the first peer will be deadlocked, together with the thread(s) dealing with the RPC request(s). This means that only one of the channels of communication to the node's peers will be blocked. Eventually the peer will timeout and excluded from the list (typically after 2 minutes). The goroutines involved in the deadlock will not be garbage collected, but they will not interfere with the system after the peer is excluded. The theoretical worst case for case 2, is a network with only two validator nodes. In this case, each of the nodes only has one `PeerState` struct. If `dump_consensus_state` is called in either node (or both), the chain will halt until the peer connections time out, after which the nodes will reconnect (with different `PeerState` structs) and the chain will progress again. Then, the same process can be repeated. As the number of nodes in a network increases, and thus, the number of peer struct each node maintains, the possibility of reproducing the perturbation visible with two nodes decreases. Only the first `PeerState` struct will deadlock, and not the others (RPC `dump_consensus_state` accesses them in a for loop, so the deadlock at the first iteration causes the rest of the iterations of that ""for"" loop to never be reached). This regression was fixed in versions 0.34.29 and 0.37.2. Some workarounds are available. For case 1 (hitting the deadlock via logs), either don't set the log output to ""json"", leave at ""plain"", or don't set the consensus logging module to ""debug"", leave it at ""info"" or higher. For case 2 (hitting the deadlock via RPC `dump_consensus_state`), do not expose `dump_consensus_state` RPC endpoint to the public internet (e.g., via rules in one's nginx setup).",9.5,internal,non-existent,yes,yes,491,,
3a00a2be-afa8-4836-9c0c-59779e2ee710,CVE-2023-3445,Cross-site Scripting (XSS) - Stored in GitHub repository spinacms/spina prior to 2.15.1.,6.4,public facing,functional,yes,yes,771,,
8b560c1f-d111-4047-ae22-823d172cc90a,CVE-2023-34449,"ink! is an embedded domain specific language to write smart contracts in Rust for blockchains built on the Substrate framework. Starting in version 4.0.0 and prior to version 4.2.1, the return value when using delegate call mechanics, either through `CallBuilder::delegate` or `ink_env::invoke_contract_delegate`, is decoded incorrectly. This bug was related to the mechanics around decoding a call's return buffer, which was changed as part of pull request 1450. Since this feature was only released in ink! 4.0.0, no previous versions are affected. Users who have an ink! 4.x series contract should upgrade to 4.2.1 to receive a patch.",9.4,internal,functional,no,yes,779,,
75b265b0-9e67-46a5-835a-4b47758c7369,CVE-2023-34448,"Grav is a flat-file content management system. Prior to version 1.7.42, the patch for CVE-2022-2073, a server-side template injection vulnerability in Grav leveraging the default `filter()` function, did not block other built-in functions exposed by Twig's Core Extension that could be used to invoke arbitrary unsafe functions, thereby allowing for remote code execution. A patch in version 1.74.2 overrides the built-in Twig `map()` and `reduce()` filter functions in `system/src/Grav/Common/Twig/Extension/GravExtension.php` to validate the argument passed to the filter in `$arrow`.",2.2,internal,proof-of-concept,no,yes,523,,
6bbcf427-6669-48ac-b38b-449507c7e1f8,CVE-2023-34442,"Exposure of Sensitive Information to an Unauthorized Actor vulnerability in Apache Software Foundation Apache Camel.This issue affects Apache Camel: from 3.X through <=3.14.8, from 3.18.X through <=3.18.7, from 3.20.X through <= 3.20.5, from 4.X through <= 4.0.0-M3. Users should upgrade to 3.14.9, 3.18.8, 3.20.6 or 3.21.0 and for users on Camel 4.x update to 4.0.0-M1",5,internal,functional,yes,no,358,,
26739896-b553-41a0-b091-43dfcb049a03,CVE-2023-3444,"An issue has been discovered in GitLab CE/EE affecting all versions starting from 15.3 before 15.11.10, all versions starting from 16.0 before 16.0.6, all versions starting from 16.1 before 16.1.1, which allows an attacker to merge arbitrary code into protected branches.",4.9,public facing,proof-of-concept,no,yes,564,,
09965c7d-6575-41c0-881b-ff6821347ff8,CVE-2023-34434,"Deserialization of Untrusted Data Vulnerability in Apache Software Foundation Apache InLong.This issue affects Apache InLong: from 1.4.0 through 1.7.0. The attacker could bypass the current logic and achieve arbitrary file reading. To solve it, users are advised to upgrade to Apache InLong's 1.8.0 or cherry-pick https://github.com/apache/inlong/pull/8130 .",5.8,internal,non-existent,yes,no,892,,
31d4badb-8b05-4515-991f-1bbb074a1194,CVE-2023-34433,PiiGAB M-Bus stores passwords using a weak hash algorithm.,6.3,public facing,functional,no,no,854,,
39310e55-8403-4c8e-949b-c4fb3f0f8723,CVE-2023-34432,"A heap buffer overflow vulnerability was found in sox, in the lsx_readbuf function at sox/src/formats_i.c:98:16. This flaw can lead to a denial of service, code execution, or information disclosure.",4.6,internal,functional,no,no,157,,
ece1dcbc-0f22-473c-aa7e-4dd49237414b,CVE-2023-34429,Weintek Weincloud v0.13.6 could allow an attacker to cause a denial-of-service condition for Weincloud by sending a forged JWT token.,2.3,public facing,functional,yes,no,65,,
b94f1217-2a1b-4c14-b294-b008aaf2428a,CVE-2023-34425,"The issue was addressed with improved memory handling. This issue is fixed in watchOS 9.6, macOS Monterey 12.6.8, iOS 15.7.8 and iPadOS 15.7.8, macOS Big Sur 11.7.9, iOS 16.6 and iPadOS 16.6, macOS Ventura 13.5. An app may be able to execute arbitrary code with kernel privileges.",1.3,public facing,functional,yes,yes,738,,
09dbf391-8ce2-4934-bced-b2ca419d70df,CVE-2023-34422,"A valid, authenticated LXCA user with elevated privileges may be able to delete folders in the LXCA filesystem through a specifically crafted web API call due to insufficient input validation.",9,public facing,non-existent,yes,yes,601,,
a0a12c4c-505e-4724-8d96-e15951b73ae0,CVE-2023-34421,"A valid, authenticated LXCA user with elevated privileges may be able to replace filesystem data through a specifically crafted web API call due to insufficient input validation.",1.9,public facing,proof-of-concept,no,no,191,,
f1803a56-a66d-4e79-bbf7-d8690a5b3a84,CVE-2023-34420,"A valid, authenticated LXCA user with elevated privileges may be able to execute command injections through crafted calls to a specific web API.",4.7,internal,functional,yes,no,107,,
f18da3b1-eb60-43c5-bf6e-864d495f9f4b,CVE-2023-3442,"A missing authorization vulnerability exists in versions of the Jenkins Plug-in for ServiceNow DevOps prior to 1.38.1 that, if exploited successfully, could cause the unwanted exposure of sensitive information. To address this issue, apply the 1.38.1 version of the Jenkins plug-in for ServiceNow DevOps on your Jenkins server. No changes are required on your instances of the Now Platform.",1.2,public facing,functional,yes,yes,161,,
4d3469d7-c192-4601-b9b9-11ac046a6c2b,CVE-2023-34418,"A valid, authenticated LXCA user may be able to gain unauthorized access to events and other data stored in LXCA due to a SQL injection vulnerability in a specific web API.",6.4,internal,proof-of-concept,no,no,169,,
30e50991-fcf9-40dd-a72f-bafabf89fb66,CVE-2023-34417,Memory safety bugs present in Firefox 113. Some of these bugs showed evidence of memory corruption and we presume that with enough effort some of these could have been exploited to run arbitrary code. This vulnerability affects Firefox < 114.,2.3,public facing,functional,yes,yes,950,,
595705c9-edf4-4322-ad98-b917240e884e,CVE-2023-34416,"Memory safety bugs present in Firefox 113, Firefox ESR 102.11, and Thunderbird 102.12. Some of these bugs showed evidence of memory corruption and we presume that with enough effort some of these could have been exploited to run arbitrary code. This vulnerability affects Firefox ESR < 102.12, Firefox < 114, and Thunderbird < 102.12.",9.7,internal,non-existent,no,yes,527,,
fd0f4a26-6c92-4595-8d72-44f2f3abe3cb,CVE-2023-34415,"When choosing a site-isolated process for a document loaded from a data: URL that was the result of a redirect, Firefox would load that document in the same process as the site that issued the redirect. This bypassed the site-isolation protections against Spectre-like attacks on sites that host an ""open redirect"". Firefox no longer follows HTTP redirects to data: URLs. This vulnerability affects Firefox < 114.",4.1,internal,functional,yes,yes,250,,
0a5eea82-1e44-4afd-bea6-42f55e68fa7a,CVE-2023-34414,"The error page for sites with invalid TLS certificates was missing the activation-delay Firefox uses to protect prompts and permission dialogs from attacks that exploit human response time delays. If a malicious page elicited user clicks in precise locations immediately before navigating to a site with a certificate error and made the renderer extremely busy at the same time, it could create a gap between when the error page was loaded and when the display actually refreshed. With the right timing the elicited clicks could land in that gap and activate the button that overrides the certificate error for that site. This vulnerability affects Firefox ESR < 102.12, Firefox < 114, and Thunderbird < 102.12.",9.9,public facing,proof-of-concept,yes,no,160,,
c7d4c429-001e-4287-9a20-aee7234d1cb7,CVE-2023-34411,The xml-rs crate before 0.8.14 for Rust and Crab allows a denial of service (panic) via an invalid <! token (such as <!DOCTYPEs/%<!A nesting) in an XML document. The earliest affected version is 0.8.9.,7.6,public facing,non-existent,yes,no,667,,
b7add901-e05e-46c3-b709-14c6e594a615,CVE-2023-34410,"An issue was discovered in Qt before 5.15.15, 6.x before 6.2.9, and 6.3.x through 6.5.x before 6.5.2. Certificate validation for TLS does not always consider whether the root of a chain is a configured CA certificate.",3.6,internal,functional,yes,no,293,,
19d8e0d9-02d4-4d81-ae4b-bdca67df5620,CVE-2023-34409,"In Percona Monitoring and Management (PMM) server 2.x before 2.37.1, the authenticate function in auth_server.go does not properly formalize and sanitize URL paths to reject path traversal attempts. This allows an unauthenticated remote user, when a crafted POST request is made against unauthenticated API routes, to access otherwise protected API routes leading to escalation of privileges and information disclosure.",4.1,internal,functional,yes,yes,311,,
33106c3a-b9de-46f0-951c-1a8879b79043,CVE-2023-34408,DokuWiki before 2023-04-04a allows XSS via RSS titles.,4.6,public facing,proof-of-concept,yes,no,122,,
78fbdd8c-d4e9-40a5-9d3e-7eaa8c11c838,CVE-2023-34407,OfflinePlayerService.exe in Harbinger Offline Player 4.0.6.0.2 allows directory traversal as LocalSystem via ..\ in a URL.,5.6,internal,non-existent,yes,yes,120,,
69e5a518-70cd-4fe2-820d-0d9cd9f1cd9f,CVE-2023-34396,"Allocation of Resources Without Limits or Throttling vulnerability in Apache Software Foundation Apache Struts.This issue affects Apache Struts: through 2.5.30, through 6.1.2. Upgrade to Struts 2.5.31 or 6.1.2.1 or greater",6.4,internal,functional,yes,yes,426,,
e512cb8b-76ee-4c16-91ac-446e1965d8b7,CVE-2023-34395,"Improper Neutralization of Argument Delimiters in a Command ('Argument Injection') vulnerability in Apache Software Foundation Apache Airflow ODBC Provider. In OdbcHook, A privilege escalation vulnerability exists in a system due to controllable ODBC driver parameters that allow the loading of arbitrary dynamic-link libraries, resulting in command execution. Starting version 4.0.0 driver can be set only from the hook constructor. This issue affects Apache Airflow ODBC Provider: before 4.0.0.",7.9,public facing,functional,yes,yes,896,,
3fe9b338-86bd-40b4-a409-0a89e2ebd0a8,CVE-2023-34394,"In Keysight Geolocation Server v2.4.2 and prior, an attacker could upload a specially crafted malicious file or delete any file or directory with SYSTEM privileges due to an improper path validation, which could result in local privilege escalation or a denial-of-service condition.",1.3,internal,non-existent,no,yes,541,,
23091db8-517e-4036-93ea-d8d82755ae76,CVE-2023-3439,"A flaw was found in the MCTP protocol in the Linux kernel. The function mctp_unregister() reclaims the device's relevant resource when a netcard detaches. However, a running routine may be unaware of this and cause the use-after-free of the mdev->addrs object, potentially leading to a denial of service.",8.3,public facing,non-existent,no,yes,15,,
4a33873a-f66e-4e98-bfd9-9c12181ca2ff,CVE-2023-3438,An unquoted Windows search path vulnerability existed in the install the MOVE 4.10.x and earlier Windows install service (mvagtsce.exe). The misconfiguration allowed an unauthorized local user to insert arbitrary code into the unquoted service path to obtain privilege escalation and stop antimalware services.,6.8,internal,functional,no,no,16,,
4f21350a-17fd-418a-99b1-dba2f9780dcf,CVE-2023-34373,Cross-Site Request Forgery (CSRF) vulnerability in Dylan James Zephyr Project Manager plugin <= 3.3.93 versions.,5,internal,functional,no,no,253,,
60ed99f2-b95a-407d-b789-31be3a81685d,CVE-2023-34369,Auth. (admin+) Stored Cross-Site Scripting (XSS) vulnerability in GrandSlambert Login Configurator plugin <= 2.1 versions.,7,internal,non-existent,no,yes,100,,
0381fdf0-0965-4b33-923b-97c1b1202929,CVE-2023-34368,Auth. (admin+) Stored Cross-Site Scripting (XSS) vulnerability in Kanban for WordPress Kanban Boards for WordPress plugin <= 2.5.20 versions.,5.4,internal,non-existent,yes,yes,524,,
f3af0d79-1f06-4cbe-a0c9-45a41efb1ff7,CVE-2023-34367,"Windows 7 is vulnerable to a full blind TCP/IP hijacking attack. The vulnerability exists in Windows 7 (any Windows until Windows 8) and in any implementation of TCP/IP, which is vulnerable to the Idle scan attack (including many IoT devices). NOTE: The vendor considers this a low severity issue.",8.5,internal,non-existent,yes,yes,882,,
